[
  {
    "userId": "550e8400-e29b-41d4-a716-446655440000",
    "date": "2024-02-06",
    "dataType": "app-usage-daily",
    "timestamp": "2024-02-07T00:05:00.000Z",
    "metrics": {
      "exercises": {
        "completed": [
          {
            "exerciseId": 12,
            "week": 2,
            "day": 3,
            "completedAt": "2024-02-06T09:15:30.000Z"
          },
          {
            "exerciseId": 15,
            "week": 2,
            "day": 3,
            "completedAt": "2024-02-06T09:45:12.000Z"
          }
        ]
      },
      "recipes": {
        "favorited": [
          {
            "recipeId": 45
          },
          {
            "recipeId": 78
          }
        ]
      },
      "education": {
        "lessonsStarted": [
          {
            "lessonId": 8,
            "startedAt": "2024-02-06T14:20:00.000Z"
          }
        ],
        "lessonsCompleted": [
          {
            "lessonId": 7,
            "completedAt": "2024-02-06T14:15:45.000Z"
          }
        ]
      },
      "gamification": {
        "badgesEarned": [
          {
            "badgeId": 3,
            "unlockedAt": "2024-02-06T09:45:30.000Z"
          }
        ]
      }
    }
  },
  {
    "userId": "660f9511-f3ac-52e5-b827-557766551111",
    "date": "2024-02-06",
    "dataType": "app-usage-daily",
    "timestamp": "2024-02-07T00:05:00.000Z",
    "metrics": {
      "exercises": {
        "completed": []
      },
      "recipes": {
        "favorited": []
      },
      "education": {
        "lessonsStarted": [],
        "lessonsCompleted": [
          {
            "lessonId": 3,
            "completedAt": "2024-02-06T16:30:22.000Z"
          }
        ]
      },
      "assessments": {
        "profileQuestionsAnswered": []
      },
      "gamification": {
        "badgesEarned": []
      }
    }
  }
]
